assistant,"Sí, vivo cerca del parque. En realidad, vivo justo enfrente. Puedes subir a mi casa antes de ir al parque y podemos ir juntos desde allí. ¿Cuándo es tu cumpleaños? Recuerdo que alguien en clase mencionó algo sobre tus próximos años, ¡perdón!",meta-llama--Llama-3.1-8B-Instruct,A1,20250322-224712.json,0.37210069596767426,0.2529827319085598,2.317142857142857,0.7669807105989297,0.3585434173669467,0.05350066727759472,4.523809523809524,4.5,2.259773431943747,8.4,5.0,4.758150901348127,1.7619047619047619,2.0,0.7174532939675887,42,38,0.9047619047619048,200,5,0.038461538461538464,0.15384615384615385,0.09615384615384616,0.057692307692307696,0.019230769230769232,0.057692307692307696,0.019230769230769232,0.15384615384615385,0.0,0.0,0.057692307692307696,0.0,0.19230769230769232,0.019230769230769232,0.0,0.1346153846153846,0.0,true,25.0,0.8076923076923077,3.8461538461538463,52.0,0.0,0.0,0.0,0.0,0.0,0.0,0.0,0.0,0.0,0.0,0.0,0.0,0.0,0.0,0.0,0.0
user,"Mi cumpleaños será en octubre, y actualmente tengo dieciocho años. Mi mamá me dice que van a ser una fiesta grande en casa, así que estoy emocionado. Gracias por preguntar. Eso sería genial si pudieras subir a mi casa antes de ir al parque. ¿Qué hora debería llegar en tu casa entonces?",meta-llama--Llama-3.1-8B-Instruct,A1,20250322-224712.json,0.42175716161727905,0.5228362381458282,2.279122807017544,0.8238695118809507,0.38701754385964915,0.061714500676268505,4.365384615384615,4.0,2.5269991792778654,10.4,10.0,4.841487374764082,1.7307692307692308,2.0,0.8347128620850269,52,44,0.8461538461538461,235,5,0.05,0.13333333333333333,0.06666666666666667,0.11666666666666667,0.016666666666666666,0.08333333333333333,0.0,0.16666666666666666,0.016666666666666666,0.0,0.03333333333333333,0.03333333333333333,0.13333333333333333,0.05,0.0,0.1,0.0,true,32.0,0.8666666666666667,3.9166666666666665,60.0,0.0,0.0,0.0,0.0,0.0,0.0,0.0,0.0,0.0,0.0,0.0,0.0,0.0,0.0,0.0,0.0
assistant,"Genial, me alegra saber que vas a tener una fiesta grande. Te recomiendo llegar a mi casa unos 15 minutos antes de las tres. Así podemos ir juntos al parque a eso de las tres menos cuarto. ¿De acuerdo? Por cierto, ¿has vivido siempre en esta ciudad o has cambiado de lugar en algún momento?",meta-llama--Llama-3.1-8B-Instruct,A1,20250322-224712.json,0.37395155616104603,0.33224838102857274,2.193522267206478,0.6195386134967604,0.46223250433776747,0.03371082643537711,4.127272727272727,4.0,2.089406574774461,11.0,13.0,4.774934554525329,1.6,1.0,0.7286350876186866,55,46,0.8363636363636363,236,5,0.0625,0.171875,0.0625,0.0625,0.015625,0.09375,0.0,0.140625,0.046875,0.0,0.0625,0.0,0.140625,0.015625,0.0,0.125,0.0,true,36.0,0.84375,3.6875,64.0,0.0,0.0,0.0,0.0,0.0,0.0,0.0,0.0,0.0,0.0,0.0,0.0,0.0,0.0,0.0,0.0
user,"Eso suena como un plan perfecto. De acuerdo, llegaremos a tu casa a las dos cincuenta y cinco. Respecto a tu pregunta, nací aquí en la ciudad, pero pasé parte de mi infancia en la costa porque mi familia se mudó allí cuando tenía siete años. Regresamos aquí cuando yo tenía doce y he vivido aquí desde entonces. Me encantaba la vida en la costa, hay mucho más playa y océano allí. Pero también estoy contento de haber regresado a la ciudad.",meta-llama--Llama-3.1-8B-Instruct,A1,20250322-224712.json,0.4720595985651016,0.4151917099952698,2.6477749401136497,0.5070499383861493,0.3687773919628758,0.07993113144026343,4.2560975609756095,4.0,2.352015096650551,13.666666666666666,12.0,6.871842709362768,1.7195121951219512,2.0,0.8449908390887807,82,59,0.7195121951219512,359,6,0.021739130434782608,0.11956521739130435,0.09782608695652174,0.043478260869565216,0.05434782608695652,0.10869565217391304,0.0,0.16304347826086957,0.05434782608695652,0.0,0.05434782608695652,0.021739130434782608,0.10869565217391304,0.03260869565217391,0.0,0.11956521739130435,0.0,true,57.0,0.8913043478260869,3.902173913043478,92.0,0.0,0.0,0.0,0.0,0.0,0.0,0.0,0.0,0.0,0.0,0.0,0.0,0.03409090909090909,0.0,0.0,0.0
assistant,"Parece que tienes muchas experiencias diferentes. La costa debe ser hermosa, especialmente durante verano. Aquí en la ciudad puede ser más bullicioso, pero tiene sus ventajas también. Me alegra que te guste vivir acá. ¿Quieres tomar algo antes de salir al parque? Un refresco o un agua fría puede ser refrescante después de hablar tanto.",meta-llama--Llama-3.1-8B-Instruct,A1,20250322-224712.json,0.3986195966601372,0.27216315641999245,2.029960317460317,0.2617283105699341,0.42063492063492053,0.07837477394049847,4.9818181818181815,5.0,2.6593978066876107,9.166666666666666,8.0,2.7938424357067015,1.8727272727272728,2.0,0.9733642774053944,55,48,0.8727272727272727,283,6,0.078125,0.078125,0.125,0.09375,0.03125,0.09375,0.0,0.125,0.0,0.0,0.046875,0.0,0.140625,0.03125,0.0,0.15625,0.0,true,33.0,0.859375,4.421875,64.0,0.0,0.0,0.0,0.0,0.0,0.0,0.0,0.0,0.0,0.0,0.0,0.0,0.0,0.0,0.0,0.0
user,"¡Claro que sí! Un refresco fresco me parece perfecto. ¿Tienes jugo de naranja o fresa? Me gustan ambos. Y gracias por la oferta, me encantaría disfrutar de un rato contigo antes de ir al parque. Es muy amable de tu parte invitarme.",meta-llama--Llama-3.1-8B-Instruct,A1,20250322-224712.json,0.32837656885385513,0.3446517040332158,1.8929824561403508,0.5467002782271143,0.4342105263157895,0.09704783639255671,4.309523809523809,4.0,2.463911864901936,8.4,7.0,4.715930449020639,1.7619047619047619,2.0,0.8676603408708855,42,36,0.8571428571428571,190,5,0.058823529411764705,0.11764705882352941,0.058823529411764705,0.0196078431372549,0.0392156862745098,0.0784313725490196,0.0196078431372549,0.17647058823529413,0.0196078431372549,0.0,0.058823529411764705,0.0196078431372549,0.17647058823529413,0.0196078431372549,0.0,0.13725490196078433,0.0,true,26.0,0.8235294117647058,3.7254901960784315,51.0,0.0,0.0,0.0,0.0,0.0,0.0,0.0,0.0,0.0,0.0,0.0,0.0,0.0,0.0,0.0,0.0
assistant,"Tengo jugo de naranja y fresa, ¿qué prefieres? Lo tengo en la nevera, así que voy a sacarlo rápido. Me alegra tenerte aquí y charlar un rato antes de ir al parque. Me gustan mucho tus historias sobre la costa, te conoces muy bien. Ahora mismo traigo los refrescos. ¿Te gustan los perros callejeros en el parque? Los veo allí todos los días.",meta-llama--Llama-3.1-8B-Instruct,A1,20250322-224712.json,0.46032188832759857,0.5031792044639587,2.3616811759668903,0.56824899220004,0.43892773892773895,0.0729509003890551,4.222222222222222,4.0,2.1708344123528582,9.0,8.0,2.8284271247461903,1.6507936507936507,1.0,0.7798805394627457,63,51,0.8095238095238095,278,7,0.02666666666666667,0.09333333333333334,0.12,0.013333333333333334,0.02666666666666667,0.12,0.0,0.16,0.0,0.0,0.09333333333333334,0.0,0.16,0.013333333333333334,0.0,0.17333333333333334,0.0,true,40.0,0.84,3.7066666666666666,75.0,0.0,0.0,0.0,0.0,0.0,0.0,0.0,0.0,0.0,0.0,0.0,0.0,0.0,0.0,0.0,0.0
user,"Prefiero el jugo de naranja, gracias. Me encanta la cara que pone la gente cuando come naranjas directamente de la fruta fresca. Sí, me gustan los perros callejeros en el parque. Los encuentro muy carinosos y siempre están contentos de jugar. Hasta conozco algunos de ellos. A veces pienso que son los verdaderos dueños del parque, ya que parecen pensar que es su territorio.",meta-llama--Llama-3.1-8B-Instruct,A1,20250322-224712.json,0.5509856462478637,0.4951803535223007,2.3209447415329767,0.5432793137714219,0.41062834224598926,0.06979428065119597,4.734375,4.5,2.629414071494826,10.666666666666666,9.5,4.818944098266987,1.859375,2.0,0.9821403206136077,64,51,0.796875,312,6,0.0684931506849315,0.1095890410958904,0.0547945205479452,0.0410958904109589,0.0136986301369863,0.1232876712328767,0.0136986301369863,0.1780821917808219,0.0,0.0,0.0684931506849315,0.0136986301369863,0.1232876712328767,0.0547945205479452,0.0,0.136986301369863,0.0,true,35.0,0.8767123287671232,4.273972602739726,73.0,0.0,0.0,0.0,0.0,0.0,0.0,0.0,0.0,0.0,0.0,0.0,0.0,0.0,0.0,0.0,0.0136986301369863
assistant,"El jugo de naranja es uno de los favoritos de muchos. Me recuerda a mi abuela, ella siempre decía que los naranjos eran mejores cuando los comías frescos, sin procesar. Me encanta que tengas amigos caninos en el parque, debe ser divertido conocerlos y jugar con ellos. Estoy seguro de que saben reconocerte y ven que eres persona de confianza. Bueno, creo que es hora de prepararnos para ir al parque. ¿Qué hora es?",meta-llama--Llama-3.1-8B-Instruct,A1,20250322-224712.json,0.5441548109054566,0.5022898726165295,2.3377850219955483,0.7439829221424699,0.4445290090026932,0.07765894643978477,4.472972972972973,4.0,2.4781366854356466,12.333333333333334,12.0,5.120763831912406,1.7567567567567568,1.0,0.9699653213473707,74,56,0.7567567567567568,342,6,0.058823529411764705,0.1411764705882353,0.011764705882352941,0.10588235294117647,0.023529411764705882,0.08235294117647059,0.011764705882352941,0.1411764705882353,0.0,0.0,0.07058823529411765,0.011764705882352941,0.12941176470588237,0.07058823529411765,0.0,0.1411764705882353,0.0,true,46.0,0.8705882352941177,4.023529411764706,85.0,0.0,0.0,0.0,0.0,0.0,0.0,0.0,0.0,0.0,0.0,0.0,0.0,0.0,0.0,0.0,0.0
user,"La hora de ir al parque. Mira el reloj, ¡son las dos cincuenta y nueve! Entonces, debemos irnos pronto para llegar al parque a las tres menos cuarto. Estoy listo, solo necesito tomar mi mochila con los libros y apagar la computadora. ¿Quieres llevarte el resto de jugo de naranja o prefieres que lo tire a la basura?",meta-llama--Llama-3.1-8B-Instruct,A1,20250322-224712.json,0.43042092956602573,0.47732887665430707,2.4603571428571427,0.39838029495750776,0.4212698412698412,0.054724855191787915,4.293103448275862,4.0,2.3562727777342674,11.6,13.0,3.6110940170535573,1.7758620689655173,2.0,0.8718411641221057,58,48,0.8275862068965517,259,5,0.04411764705882353,0.1323529411764706,0.04411764705882353,0.04411764705882353,0.04411764705882353,0.1323529411764706,0.0,0.16176470588235295,0.058823529411764705,0.0,0.014705882352941176,0.014705882352941176,0.14705882352941177,0.014705882352941176,0.0,0.14705882352941177,0.0,true,33.0,0.8529411764705882,3.8088235294117645,68.0,0.0,0.0,0.0,0.0,0.0,0.0,0.0,0.0,0.0,0.0,0.0,0.0,0.0,0.0,0.0,0.0
assistant,"Muy bien, tenemos prisa. Déjame ayudarte a cerrar la puerta mientras tú buscas tu mochila y apagas la computadora. Luego nos vamos al parque. Con respecto al jugo de naranja, no te preocupes por eso, te dejaré cuidar de él. Vamos a aprovechar que aún no ha salido la lluvia. Estoy ansioso por pasar el rato contigo y Carlos y Sofía en el parque.",meta-llama--Llama-3.1-8B-Instruct,A1,20250322-224712.json,0.4195557951927185,0.4441007748246193,2.1180489101541737,0.600953434608822,0.40451887293992556,0.08262715813863121,4.265625,4.0,2.431834361007139,10.666666666666666,12.0,4.749268949591669,1.71875,1.5,0.856386850377795,64,51,0.796875,282,6,0.0136986301369863,0.1232876712328767,0.0821917808219178,0.0410958904109589,0.0410958904109589,0.0958904109589041,0.0,0.136986301369863,0.0,0.0,0.0821917808219178,0.0684931506849315,0.1232876712328767,0.0273972602739726,0.0,0.1643835616438356,0.0,true,40.0,0.8767123287671232,3.863013698630137,73.0,0.0,0.0,0.0,0.0,0.0,0.0,0.0,0.0,0.0,0.0,0.0,0.0,0.0,0.0,0.0,0.0
user,"Gracias por ayudarme a cerrar la puerta. Estoy casi listo para irme. Solo necesito llevar la mochila y los libros. ¡Perfecto, todo listo! Me alegra que puedas venir contigo y pasarlo bien al parque. Lleguemos pronto y podemos sentarnos en un banco al aire libre. Espero que la lluvia no llegue hasta que terminemos de disfrutar del parque. Vamos, vámonos.",meta-llama--Llama-3.1-8B-Instruct,A1,20250322-224712.json,0.45827489097913104,0.5430794835090638,1.9909297052154196,0.4223785913075236,0.3903061224489796,0.0888007380828829,4.75,5.0,2.299456457513384,8.571428571428571,8.0,4.030495994190253,1.9,2.0,0.8103497187428811,60,51,0.85,296,7,0.04225352112676056,0.1267605633802817,0.07042253521126761,0.056338028169014086,0.04225352112676056,0.08450704225352113,0.0,0.15492957746478872,0.0,0.0,0.014084507042253521,0.014084507042253521,0.15492957746478872,0.04225352112676056,0.0,0.19718309859154928,0.0,true,32.0,0.8450704225352113,4.169014084507042,71.0,0.0,0.0,0.0,0.0,0.0,0.0,0.0,0.0,0.0,0.0,0.0,0.0,0.0,0.0,0.0,0.014084507042253521
system,"You are an AI language tutor assisting a student in learning Spanish by acting as their dialogue partner.
The student is learning Spanish at A1 level in the Common European Framework of Reference (CEFR) which means that the user is at a beginner level of Spanish.

As an AI tutor, your instructions are:
1. Act as a natural dialogue partner, guiding the student to practice their Spanish through realistic and engaging interactions. This means asking the student questions in a natural manner.
2. Limit your grammar and vocabulary to A1-level Spanish (beginner level).
3. If the student makes mistakes, you should correct their mistakes and explain them in detail.
4. Keep everything in Spanish.

Remember to keep the conversation at a language level appropriate for a beginner learner of Spanish. Specifically, the aim for the student is to master the following language skills after A1: 
- The student understand and use familiar everyday expressions and very basic phrases aimed at the satisfaction of needs of a concrete type.
- The student can introduce him/herself and others and can ask and answer questions about personal details such as where he/she lives, people he/she knows and things he/she has.
- The student can interact in a simple way provided the other person talks slowly and clearly and is prepared to help.
",meta-llama--Llama-3.1-8B-Instruct,A1,20250322-224819.json,0.7075007617473602,0.6994680629836189,4.351010554824339,1.289030883923605,0.34173989694453905,0.08269101007888388,4.701298701298701,4.0,2.751142706615347,21.0,17.0,17.273205734999983,1.6753246753246753,1.0,0.8940625472017476,231,124,0.5367965367965368,1119,11,0.026515151515151516,0.06439393939393939,0.0,0.003787878787878788,0.0,0.0,0.0,0.06060606060606061,0.015151515151515152,0.0,0.003787878787878788,0.625,0.125,0.0,0.0,0.03409090909090909,0.0,true,11.0,0.8181818181818182,4.238636363636363,264.0,0.0,0.0,0.21428571428571427,0.0,0.0,0.0,0.0286144578313253,0.0286144578313253,0.0,0.0,0.0,0.0,0.010542168674698794,0.01355421686746988,0.03162650602409638,0.06060606060606061
user,Hola,meta-llama--Llama-3.1-8B-Instruct,A1,20250322-224819.json,,,0.0,0.0,0.0,0.0,4.0,4.0,0.0,1.0,1.0,0.0,2.0,2.0,0.0,1,1,1.0,4,1,0.0,0.0,0.0,0.0,0.0,0.0,0.0,0.0,0.0,0.0,0.0,1.0,0.0,0.0,0.0,0.0,0.0,false,0.0,1.0,4.0,1.0,0.0,0.0,0.0,0.0,0.0,0.0,0.0,0.0,0.0,0.0,0.0,0.0,0.0,0.0,0.0,0.0
assistant,Hola. ¿Cómo estás? ¿Te llamas...?,meta-llama--Llama-3.1-8B-Instruct,A1,20250322-224819.json,0.5291845202445984,0.2811128795146942,0.9,0.2943920288775949,0.4666666666666666,0.04714045207910316,4.2,4.0,1.32664991614216,1.6666666666666667,2.0,0.4714045207910317,1.8,2.0,0.4,5,5,1.0,29,3,0.0,0.0,0.0,0.0,0.0,0.0,0.0,0.09090909090909091,0.0,0.0,0.18181818181818182,0.09090909090909091,0.5454545454545454,0.0,0.0,0.09090909090909091,0.0,false,2.0,0.45454545454545453,2.6363636363636362,11.0,0.0,0.0,0.0,0.0,0.0,0.0,0.0,0.0,0.0,0.0,0.0,0.0,0.0,0.0,0.0,0.0
user,"Estoy bien, gracias. Me llamo Sofía. ¿Y tú?",meta-llama--Llama-3.1-8B-Instruct,A1,20250322-224819.json,0.2359747216105461,0.12507213652133942,1.1333333333333333,0.18856180831641264,0.4666666666666666,0.04714045207910316,3.875,4.5,1.899835519196333,2.6666666666666665,3.0,0.4714045207910317,1.5,1.5,0.5,8,8,1.0,36,3,0.0,0.0,0.07692307692307693,0.07692307692307693,0.07692307692307693,0.0,0.0,0.07692307692307693,0.0,0.0,0.15384615384615385,0.07692307692307693,0.38461538461538464,0.0,0.0,0.07692307692307693,0.0,false,5.0,0.6153846153846154,2.769230769230769,13.0,0.0,0.0,0.0,0.0,0.0,0.0,0.0,0.0,0.0,0.0,0.0,0.0,0.0,0.0,0.0,0.0
assistant,"Me llamo Ana. Soy de Madrid. ¿De dónde eres, Sofía? ¿Vives en Madrid también?",meta-llama--Llama-3.1-8B-Instruct,A1,20250322-224819.json,0.3278178696831067,0.23959873616695404,1.476190476190476,0.30163951093618874,0.37797619047619047,0.09463162556895623,4.071428571428571,4.5,1.6675167899898216,3.5,3.5,0.5,1.5,1.5,0.5,14,12,0.8571428571428571,64,4,0.0,0.14285714285714285,0.047619047619047616,0.047619047619047616,0.0,0.0,0.0,0.0,0.0,0.0,0.09523809523809523,0.23809523809523808,0.3333333333333333,0.0,0.0,0.09523809523809523,0.0,false,8.0,0.6666666666666666,3.0476190476190474,21.0,0.0,0.0,0.0,0.0,0.0,0.0,0.0,0.0,0.0,0.0,0.0,0.0,0.0,0.0,0.0,0.0
user,"Encantada de conocerte, Ana. Yo soy de Barcelona. Sí, vivo en Madrid ahora porque estoy estudiando aquí en la universidad. ¿Y tú qué estudias en Madrid?",meta-llama--Llama-3.1-8B-Instruct,A1,20250322-224819.json,0.3191184103488922,0.24834489822387695,1.6085714285714285,0.7081219772707789,0.3514285714285714,0.09491134423927482,4.615384615384615,3.5,2.9622876175338013,5.2,4.0,3.7629775444453557,1.8846153846153846,1.0,1.1544870015233564,26,22,0.8461538461538461,127,5,0.06060606060606061,0.15151515151515152,0.06060606060606061,0.06060606060606061,0.030303030303030304,0.030303030303030304,0.030303030303030304,0.030303030303030304,0.0,0.0,0.09090909090909091,0.12121212121212122,0.21212121212121213,0.030303030303030304,0.0,0.09090909090909091,0.0,true,16.0,0.7878787878787878,3.8484848484848486,33.0,0.0,0.0,0.0,0.0,0.0,0.0,0.0,0.0,0.0,0.0,0.0,0.0,0.0,0.0,0.0,0.0
assistant,"Encantada también, Sofía. Ah, muy interesante que vengas a estudiar aquí desde Barcelona. ¿Qué te gustaría estudiar en Madrid? Estudio diseño gráfico, soy diseñadora gráfica.",meta-llama--Llama-3.1-8B-Instruct,A1,20250322-224819.json,0.3255566085378329,0.19810109585523605,1.8395833333333333,0.3340292215261015,0.39166666666666666,0.0176776695296637,5.68,6.0,2.7381745744199733,6.25,6.0,2.48746859276655,2.32,2.0,1.2560254774486066,25,24,0.96,150,4,0.12121212121212122,0.09090909090909091,0.09090909090909091,0.030303030303030304,0.0,0.0,0.030303030303030304,0.06060606060606061,0.0,0.0,0.06060606060606061,0.12121212121212122,0.24242424242424243,0.030303030303030304,0.0,0.12121212121212122,0.0,true,10.0,0.7575757575757576,4.545454545454546,33.0,0.0,0.0,0.0,0.0,0.0,0.0,0.0,0.0,0.0,0.0,0.0,0.0,0.0,0.0,0.0,0.0
user,"Genial, me encanta el diseño gráfico. A mí me gusta la literatura y estudio filología hispánica, soy estudiante de licenciatura. Me interesa mucho la historia y la cultura española, especialmente la literatura del Siglo de Oro. ¿Alguna vez has trabajado en un proyecto de diseño para una editorial o algo similar?",meta-llama--Llama-3.1-8B-Instruct,A1,20250322-224819.json,0.5280038714408875,0.29215556383132935,2.4553717320261437,0.5317971192024326,0.43280228758169936,0.04592046565558637,5.0,4.0,3.217598666159375,12.75,14.5,3.960744879438715,2.215686274509804,2.0,1.3476737472501634,51,41,0.803921568627451,263,4,0.0847457627118644,0.11864406779661017,0.03389830508474576,0.03389830508474576,0.05084745762711865,0.13559322033898305,0.0,0.2033898305084746,0.0,0.0,0.0847457627118644,0.05084745762711865,0.13559322033898305,0.0,0.0,0.06779661016949153,0.0,true,26.0,0.864406779661017,4.4576271186440675,59.0,0.0,0.0,0.0,0.0,0.0,0.0,0.0,0.0,0.0,0.0,0.0,0.0,0.0,0.0,0.0,0.0
assistant,"Eso es genial, Sofía! La literatura española es rica y fascinante. Sí, he trabajado en algunos proyectos con editores, pero también con pequeñas empresas locales que necesitan identidad visual. Me encanta la creatividad de trabajar con libros y publicaciones. ¿Te gustan autores como Cervantes o Lorca?",meta-llama--Llama-3.1-8B-Instruct,A1,20250322-224819.json,0.386699590831995,0.3127431670824687,1.8698412698412696,0.3977956392701195,0.4512265512265513,0.06573121044237458,5.391304347826087,5.5,3.1379740131767186,9.2,7.0,4.791659420284375,2.1956521739130435,2.0,1.1908996456349858,46,41,0.8913043478260869,257,5,0.12727272727272726,0.09090909090909091,0.01818181818181818,0.05454545454545454,0.07272727272727272,0.05454545454545454,0.01818181818181818,0.16363636363636364,0.0,0.0,0.07272727272727272,0.07272727272727272,0.14545454545454545,0.01818181818181818,0.0,0.09090909090909091,0.0,true,22.0,0.8363636363636363,4.672727272727273,55.0,0.0,0.0,0.0,0.0,0.0,0.0,0.0,0.0,0.0,0.0,0.0,0.0,0.0,0.0,0.0,0.0
user,"¡Absolutamente! Me fascina Don Quijote y la obra de Lorca es emocionante. También me gustan muchísimo autores como Federico García Lorca, Pablo Neruda y Miguel Hernández. Su lenguaje y su visión sobre la realidad son verdaderamente impactantes. Me encanta leer sus poemas y obras, hay tantos temas y simbolismos que explorar. ¿Y tú, ¿cuál es tu autor favorito entre todos estos?",meta-llama--Llama-3.1-8B-Instruct,A1,20250322-224819.json,0.3813822865486145,0.4218681852022807,2.715,0.45204473721573674,0.4203571428571428,0.11124705402606605,5.016393442622951,5.0,3.0967555908507203,12.2,12.0,1.6,2.0327868852459017,2.0,1.2276488673343644,61,50,0.819672131147541,318,5,0.0410958904109589,0.0410958904109589,0.0547945205479452,0.0547945205479452,0.0821917808219178,0.1095890410958904,0.0,0.136986301369863,0.0,0.0,0.0958904109589041,0.136986301369863,0.1643835616438356,0.0136986301369863,0.0,0.0684931506849315,0.0,true,29.0,0.8356164383561644,4.3561643835616435,73.0,0.0,0.0,0.0,0.0,0.0,0.0,0.0,0.0,0.0,0.0,0.0,0.0,0.0,0.0,0.0,0.0
assistant,"¡Tienes grandes gustos literarios, Sofía! Es difícil elegir solo uno, pero si tuviera que escoger, creo que mi autor favorito es Federico García Lorca. Me gusta la forma en que describe la vida rural andaluza y las costumbres de la gente. También me impresiona la forma en que explora los temas de amor y muerte en su obra. ""Diván del Tamarit"" es una de mis piezas favoritas. ¿Sabes que Lorca nació en Fuentevaqueros, cerca de Granada? ¿Has estado alguna vez allí?",meta-llama--Llama-3.1-8B-Instruct,A1,20250322-224819.json,0.5142362415790558,0.34128593071363866,2.596560846560847,0.6008276651003747,0.4257936507936508,0.07327672234842952,4.54320987654321,4.0,2.4897289391658157,13.5,13.0,6.422616289332565,1.8271604938271604,2.0,0.9911973487243974,81,62,0.7654320987654321,384,6,0.07216494845360824,0.09278350515463918,0.041237113402061855,0.05154639175257732,0.030927835051546393,0.10309278350515463,0.0,0.13402061855670103,0.0,0.0,0.061855670103092786,0.09278350515463918,0.16494845360824742,0.041237113402061855,0.0,0.1134020618556701,0.0,true,43.0,0.8350515463917526,3.9587628865979383,97.0,0.0,0.0,0.0,0.0,0.0,0.0,0.0,0.0,0.0,0.0,0.0,0.0,0.0,0.0,0.0,0.010309278350515464
user,"¡Federico García Lorca es un poeta increíble! Me encanta su capacidad para evocar la belleza y la tristeza de la vida al mismo tiempo. Y sí, conozco que nació en Fuente Vaqueros, cerca de Granada, aunque no he tenido la oportunidad de visitar todavía. Pero me gustaría mucho ir algún día, porque la región de Andalucía tiene tanta riqueza cultural y arquitectónica. Recuerdo que cuando estaba en Barcelona, solía visitar el Archivo de la Literatura Catalana, que tiene una sección dedicada a los autores españoles, incluyendo a Lorca. Me gustaría ver más cosas sobre él y su vida en Andalucía. ¿Cuándo fuiste por primera vez a Fuentevaqueros?",meta-llama--Llama-3.1-8B-Instruct,A1,20250322-224819.json,0.5776959598064423,0.6130749508738518,2.7836894586894583,0.3606547645568702,0.4087132003798671,0.0391996303154232,4.859813084112149,5.0,2.885505505303571,17.833333333333332,19.0,6.593346814950828,2.046728971962617,2.0,1.1388071934002106,107,80,0.7476635514018691,536,6,0.04878048780487805,0.12195121951219512,0.04065040650406504,0.016260162601626018,0.04065040650406504,0.12195121951219512,0.008130081300813009,0.12195121951219512,0.0,0.0,0.04878048780487805,0.11382113821138211,0.13008130081300814,0.04065040650406504,0.0,0.14634146341463414,0.0,true,61.0,0.8699186991869918,4.357723577235772,123.0,0.0,0.0,0.0,0.0,0.0,0.0,0.0,0.0,0.0,0.0,0.0,0.0,0.0,0.0,0.0,0.008130081300813009
assistant,"Sofía, eres verdaderamente apasionada por la literatura y la cultura. El Archivo de la Literatura Catalana debe ser un lugar fascinante. En cuanto a Fuentevaqueros, no he ido hasta allí personalmente, pero tengo un amigo que vive cerca de Granada y ha ido varias veces. Dice que es un pueblo precioso con una gran riqueza cultural. Lo pienso visitar pronto para conocer mejor la zona y descubrir los lugares que rodearon la infancia y juventud de Lorca. ¿Has leído alguno de los relatos cortos de Lorca? Son muy interesantes.",meta-llama--Llama-3.1-8B-Instruct,A1,20250322-224819.json,0.48184630274772644,0.4600683093070984,2.216690716690717,0.5549448333851332,0.41534391534391535,0.0923976446399795,4.786516853932584,4.0,3.00737636267804,12.714285714285714,11.0,6.734013571081528,1.9662921348314606,2.0,1.203454187774911,89,70,0.7865168539325843,437,7,0.07,0.11,0.08,0.08,0.05,0.13,0.0,0.13,0.0,0.0,0.04,0.08,0.11,0.01,0.0,0.11,0.0,true,52.0,0.89,4.37,100.0,0.0,0.0,0.0,0.0,0.0,0.0,0.0,0.0,0.0,0.0,0.0,0.0,0.0,0.0,0.0,0.01
