assistant,Hola. ¿Cómo estás? ¿De dónde eres?,meta-llama--Llama-3.1-8B-Instruct,A1,20250322-224453.json,0.5352852940559387,0.2155071198940277,0.9,0.2943920288775949,0.5333333333333333,0.04714045207910316,4.0,4.0,1.0,2.0,2.0,0.816496580927726,1.6666666666666667,2.0,0.4714045207910317,6,6,1.0,29,3,0.0,0.09090909090909091,0.0,0.09090909090909091,0.0,0.0,0.0,0.0,0.0,0.0,0.18181818181818182,0.09090909090909091,0.45454545454545453,0.0,0.0,0.09090909090909091,0.0,false,4.0,0.5454545454545454,2.6363636363636362,11.0,0.0,0.0,0.0,0.0,0.0,0.0,0.0,0.0,0.0,0.0,0.0,0.0,0.0,0.0,0.0,0.0
user,"Estoy bien, gracias. Soy de Estados Unidos. ¿Y tú?",meta-llama--Llama-3.1-8B-Instruct,A1,20250322-224453.json,0.11655879765748978,0.12507213652133942,1.2,0.16329931618554516,0.43333333333333335,0.04714045207910316,4.111111111111111,4.0,2.1314806770278754,3.0,3.0,0.816496580927726,1.5555555555555556,1.0,0.6849348892187752,9,9,1.0,42,3,0.0,0.07142857142857142,0.07142857142857142,0.14285714285714285,0.07142857142857142,0.0,0.0,0.07142857142857142,0.0,0.0,0.07142857142857142,0.14285714285714285,0.35714285714285715,0.0,0.0,0.0,0.0,false,7.0,0.6428571428571429,3.0,14.0,0.0,0.0,0.0,0.0,0.0,0.0,0.0,0.0,0.0,0.0,0.0,0.0,0.0,0.0,0.0,0.0
assistant,Me llamo Ana. Soy de Madrid. Me gusta el fútbol y la música. ¿Te gusta el fútbol?,meta-llama--Llama-3.1-8B-Instruct,A1,20250322-224453.json,0.25964827338854474,0.2291335454210639,1.375,0.414578098794425,0.4270833333333333,0.07438987946398803,3.5294117647058822,3.0,1.7861442883163503,4.25,3.5,1.6393596310755,1.4705882352941178,1.0,0.6056253024110001,17,13,0.7647058823529411,65,4,0.0,0.045454545454545456,0.0,0.045454545454545456,0.045454545454545456,0.13636363636363635,0.0,0.13636363636363635,0.0,0.0,0.13636363636363635,0.09090909090909091,0.22727272727272727,0.0,0.0,0.13636363636363635,0.0,false,9.0,0.7727272727272727,2.9545454545454546,22.0,0.0,0.0,0.0,0.0,0.0,0.0,0.0,0.0,0.0,0.0,0.0,0.0,0.0,0.0,0.0,0.0
user,Me parece interesante el fútbol. Aunque no sé mucho sobre él. ¿Cuál es tu equipo favorito? Y ¿qué tipo de música te gusta escuchar?,meta-llama--Llama-3.1-8B-Instruct,A1,20250322-224453.json,0.46947231888771057,0.38729409873485565,1.9345238095238095,0.33391743042275596,0.4035714285714286,0.0771792242320511,4.25,4.0,2.48746859276655,6.0,5.5,1.224744871391589,1.8333333333333333,1.5,1.0671873729054748,24,24,1.0,108,4,0.06666666666666667,0.06666666666666667,0.06666666666666667,0.03333333333333333,0.03333333333333333,0.1,0.0,0.13333333333333333,0.0,0.0,0.13333333333333333,0.0,0.2,0.03333333333333333,0.0,0.13333333333333333,0.0,true,16.0,0.8,3.6,30.0,0.0,0.0,0.0,0.0,0.0,0.0,0.0,0.0,0.0,0.0,0.0,0.0,0.0,0.0,0.0,0.0
assistant,Mi equipo favorito es el Real Madrid. Me encanta verlos jugar en el Santiago Bernabéu. La música... me gustan las canciones de flamenco. ¿Sabes qué es el flamenco?,meta-llama--Llama-3.1-8B-Instruct,A1,20250322-224453.json,0.26403061548868817,0.16457249224185944,1.8436507936507935,0.28991293295119797,0.46031746031746035,0.1033271156054884,4.571428571428571,4.5,2.4846467329894413,7.0,7.5,1.224744871391589,1.8214285714285714,1.5,0.9278843611976129,28,23,0.8214285714285714,136,4,0.029411764705882353,0.058823529411764705,0.0,0.058823529411764705,0.0,0.17647058823529413,0.0,0.14705882352941177,0.0,0.0,0.08823529411764706,0.11764705882352941,0.17647058823529413,0.0,0.0,0.14705882352941177,0.0,true,14.0,0.8235294117647058,4.0,34.0,0.0,0.0,0.0,0.0,0.0,0.0,0.0,0.0,0.0,0.0,0.0,0.0,0.0,0.0,0.0,0.0
user,"Sí, conozco un poco el flamenco. Es una forma de música tradicional española, ¿verdad? Me han dicho que es muy emotiva y apasionada. Mi abuela era amiga de alguien que tocaba la guitarra flamenca. Ella siempre me decía que es muy hermoso. ¿Has ido alguna vez al tablao?",meta-llama--Llama-3.1-8B-Instruct,A1,20250322-224453.json,0.401244181394577,0.48139476776123047,2.026641414141414,0.21342959434117545,0.39196127946127945,0.10393701515483411,4.416666666666667,3.0,2.4395468613840743,8.0,8.0,1.7320508075688772,1.7708333333333333,1.0,0.9626262543456602,48,41,0.8541666666666666,222,6,0.10344827586206896,0.05172413793103448,0.06896551724137931,0.10344827586206896,0.017241379310344827,0.10344827586206896,0.017241379310344827,0.15517241379310345,0.0,0.0,0.08620689655172414,0.0,0.1724137931034483,0.034482758620689655,0.0,0.08620689655172414,0.0,true,29.0,0.8275862068965517,3.8275862068965516,58.0,0.0,0.0,0.0,0.0,0.0,0.0,0.0,0.0,0.0,0.0,0.0,0.0,0.0,0.0,0.0,0.0
assistant,"¡Exacto! El flamenco es muy emocionante. Sí, he ido al tablao varias veces. Me encanta el ambiente y los bailarines son increíbles. Un momento tan solo para disfrutar del ritmo y la pasión. Tu abuela debe haber tenido mucha suerte de conocer a alguien que tocara la guitarra flamenca. ¿Quieres aprender a bailar flamenco algún día?",meta-llama--Llama-3.1-8B-Instruct,A1,20250322-224453.json,0.4316105663776398,0.2618822380900383,2.2579520697167754,0.21802608418353492,0.4552832244008715,0.05011855193259442,4.75,5.0,2.6339134382131846,9.333333333333334,8.0,3.39934634239519,1.8571428571428572,2.0,0.8748177652797064,56,51,0.9107142857142857,276,6,0.07575757575757576,0.09090909090909091,0.015151515151515152,0.07575757575757576,0.030303030303030304,0.15151515151515152,0.015151515151515152,0.21212121212121213,0.0,0.0,0.045454545454545456,0.0,0.15151515151515152,0.0,0.0,0.13636363636363635,0.0,true,33.0,0.8484848484848485,4.181818181818182,66.0,0.0,0.0,0.0,0.0,0.0,0.0,0.0,0.0,0.0,0.0,0.0,0.0,0.0,0.0,0.0,0.0
user,"¡Eso sería fantástico! Me encantaría aprender a bailar flamenco. De hecho, mi familia es de origen español por parte de mi madre, así que creo que tengo algo de sangre flamenca dentro. Quizá si vuelvo a España algún día puedo tomar clases de baile flamenco. ¿Tú también conoces cómo bailar un poco?",meta-llama--Llama-3.1-8B-Instruct,A1,20250322-224453.json,0.4517621298631032,0.40688787400722504,2.3224969474969472,0.48011562350408393,0.42948717948717946,0.07280651725384966,4.576923076923077,5.0,2.273138747044185,13.0,11.0,6.164414002968976,1.8076923076923077,2.0,0.8095217376865073,52,43,0.8269230769230769,247,4,0.06557377049180328,0.13114754098360656,0.06557377049180328,0.04918032786885246,0.0,0.06557377049180328,0.0,0.16393442622950818,0.0,0.0,0.09836065573770492,0.01639344262295082,0.14754098360655737,0.04918032786885246,0.0,0.14754098360655737,0.0,true,33.0,0.8524590163934426,4.049180327868853,61.0,0.0,0.0,0.0,0.0,0.0,0.0,0.0,0.0,0.0,0.0,0.0,0.0,0.0,0.0,0.0,0.0
assistant,"¡Eso es genial! Tienes razón, podrías tener un lado flamenco. Sí, estoy empezando a aprender a bailar un poquito. Mi abuela también me enseñó algunos pasos básicos cuando era pequeña. Me encantaría verte bailar algún día. ¿Cuándo piensas volver a España?",meta-llama--Llama-3.1-8B-Instruct,A1,20250322-224453.json,0.46482332050800323,0.36737025777498883,1.988961038961039,0.3421874608908978,0.4599567099567099,0.05709528388308112,4.975609756097561,6.0,2.321561762788448,8.2,9.0,2.3151673805580453,1.951219512195122,2.0,0.8249529036725738,41,36,0.8780487804878049,214,5,0.0784313725490196,0.058823529411764705,0.0196078431372549,0.0784313725490196,0.0,0.09803921568627451,0.0196078431372549,0.11764705882352941,0.0,0.0,0.0784313725490196,0.0196078431372549,0.19607843137254902,0.0196078431372549,0.0,0.21568627450980393,0.0,true,21.0,0.803921568627451,4.196078431372549,51.0,0.0,0.0,0.0,0.0,0.0,0.0,0.0,0.0,0.0,0.0,0.0,0.0,0.0,0.0,0.0,0.0
user,"¡Genial! Me alegraría poder bailar para ti algún día. No hay una fecha concreta para volver a España, pero espero ir pronto. Necesito terminar mis estudios aquí primero. Pero estaría bien visitarte en Madrid antes o después de eso. ¿Qué partes de España te gustaría recomendarle a alguien que venga a visitar?",meta-llama--Llama-3.1-8B-Instruct,A1,20250322-224453.json,0.47666462510824203,0.5327631235122681,2.2185714285714284,0.23363634358353555,0.46904761904761905,0.04353954076442842,4.788461538461538,5.0,2.4910342188115244,10.4,11.0,2.65329983228432,1.9423076923076923,2.0,0.9690094374880094,52,46,0.8846153846153846,258,5,0.01639344262295082,0.13114754098360656,0.11475409836065574,0.04918032786885246,0.04918032786885246,0.06557377049180328,0.01639344262295082,0.06557377049180328,0.0,0.0,0.09836065573770492,0.04918032786885246,0.14754098360655737,0.0,0.0,0.19672131147540983,0.0,true,31.0,0.8524590163934426,4.229508196721311,61.0,0.0,0.0,0.0,0.0,0.0,0.0,0.0,0.0,0.0,0.0,0.0,0.0,0.0,0.0,0.0,0.0
assistant,"¡Genial! Estupendo que puedas venir a Madrid algún día. Hay muchas cosas hermosas cerca de Madrid que vale la pena visitar. Te recomiendo que visites Segovia, está cerca de Madrid y tiene un castillo muy famoso. También el parque nacional de la Sierra de Guadarrama es muy bonito. Si tienes más tiempo, puedes viajar a Andalucía, donde nació el flamenco. ¡Es un lugar mágico! ¿Te interesa saber más?",meta-llama--Llama-3.1-8B-Instruct,A1,20250322-224453.json,0.5178821325302124,0.46078930608928204,2.371945701357466,0.33030118813401954,0.4250125691302162,0.03111310407096304,4.676470588235294,5.0,2.341701094042711,11.333333333333334,12.0,2.285218200133681,1.8970588235294117,2.0,0.9097463428365613,68,52,0.7647058823529411,332,6,0.08536585365853659,0.07317073170731707,0.08536585365853659,0.07317073170731707,0.012195121951219513,0.0975609756097561,0.0,0.0975609756097561,0.0,0.0,0.04878048780487805,0.08536585365853659,0.17073170731707318,0.036585365853658534,0.0,0.13414634146341464,0.0,true,34.0,0.8292682926829268,4.048780487804878,82.0,0.0,0.0,0.0,0.0,0.0,0.0,0.0,0.0,0.0,0.0,0.0,0.0,0.0,0.0,0.0,0.0
user,"¡Muchas gracias por recomendarme! Me encantaría visitar Segovia y el parque nacional de la Sierra de Guadarrama. Es genial que tengas tanta conexión con esa zona. Y claro que sí, me encantaría viajar a Andalucía. Sé que es el corazón del flamenco y la cultura andaluza es fascinante. ¿Puedo preguntarte, ¿tienes un lugar o ciudad favorita en Andalucía?",meta-llama--Llama-3.1-8B-Instruct,A1,20250322-224453.json,0.4148905947804451,0.44297196467717487,2.44987012987013,0.4366639350121867,0.39987012987012993,0.035986916908297126,4.896551724137931,5.0,3.0325228780580207,11.6,10.0,3.0724582991474434,2.0172413793103448,2.0,1.1669497420012218,58,46,0.7931034482758621,295,5,0.057971014492753624,0.10144927536231885,0.014492753623188406,0.07246376811594203,0.057971014492753624,0.10144927536231885,0.014492753623188406,0.13043478260869565,0.0,0.0,0.043478260869565216,0.07246376811594203,0.15942028985507245,0.043478260869565216,0.0,0.13043478260869565,0.0,true,30.0,0.8405797101449275,4.27536231884058,69.0,0.0,0.0,0.0,0.0,0.0,0.0,0.0,0.0,0.0,0.0,0.0,0.0,0.0,0.0,0.0,0.0
assistant,"Andalucía es un país en sí mismo. Tengo muchas conexiones con Málaga, porque mi familia tiene allí. Me encanta la playa de la Malagueta y la Gibralfaro. Y no te puedes perder el Alhambra, aunque está en Granada, que está cerca de Málaga. Es increíble la historia y la arquitectura. ¿Tú preferirías la costa o la montaña?",meta-llama--Llama-3.1-8B-Instruct,A1,20250322-224453.json,0.40451654195785525,0.46919821575284004,2.2581738437001597,0.41108921864421705,0.3720095693779904,0.02446419475571501,4.456140350877193,4.0,2.8780486532505094,9.5,8.5,3.2015621187164243,1.8596491228070176,1.0,1.0668628628428611,57,44,0.7719298245614035,264,6,0.014925373134328358,0.07462686567164178,0.04477611940298507,0.07462686567164178,0.05970149253731343,0.1791044776119403,0.0,0.11940298507462686,0.0,0.0,0.07462686567164178,0.1044776119402985,0.14925373134328357,0.029850746268656716,0.0,0.07462686567164178,0.0,true,36.0,0.8507462686567164,3.9402985074626864,67.0,0.0,0.0,0.0,0.0,0.0,0.0,0.0,0.0,0.0,0.0,0.0,0.0,0.0,0.0,0.0,0.0
user,"Me encantaría explorar toda Andalucía, pero creo que tendría que decir que prefiero la montaña. La idea de caminar por los pueblos blancos de la serranía gaditana me llama la atención. Y luego, claro, la Alhambra es impresionante, la he visto en fotos y estoy ansioso por verla en persona. La historia y la arquitectura andalusíes son realmente únicas. ¿Conoces algún buen restaurante en Málaga donde pueda probar la comida local?",meta-llama--Llama-3.1-8B-Instruct,A1,20250322-224453.json,0.5489250496029854,0.6874237855275472,2.3490902447935698,0.26280198842487096,0.44914139568871025,0.031852409056619665,4.929577464788732,5.0,2.8399759156981736,14.2,15.0,3.4292856398964493,1.943661971830986,2.0,1.0466219832765802,71,54,0.7605633802816901,360,5,0.09876543209876543,0.08641975308641975,0.037037037037037035,0.06172839506172839,0.04938271604938271,0.13580246913580246,0.0,0.13580246913580246,0.0,0.0,0.04938271604938271,0.037037037037037035,0.12345679012345678,0.037037037037037035,0.0,0.14814814814814814,0.0,true,39.0,0.8765432098765432,4.444444444444445,81.0,0.0,0.0,0.0,0.0,0.0,0.0,0.0,0.0,0.0,0.0,0.0,0.0,0.0,0.0,0.0,0.0
assistant,"La serranía gaditana es un paraíso natural. Hay muchos pueblos preciosos con vistas impresionantes. En Málaga hay muchos restaurantes buenos donde puedes probar la comida local. Uno de mis favoritos es El Pimpi, están servidas tapas auténticas y el ambiente es muy acogedor. Otro lugar que recomiendo es El Mesón de Cervantes, tienen una variedad de platos típicos andaluces y un jardín precioso. ¡Volveremos hablando más sobre comida andaluza cuando lo-visites!",meta-llama--Llama-3.1-8B-Instruct,A1,20250322-224453.json,0.492804616689682,0.48896294087171555,2.0408707520549623,0.40558991311919984,0.5114341798552324,0.09590967705571071,5.394366197183099,6.0,2.8996302495679487,11.833333333333334,10.0,5.07991688470939,2.1549295774647885,2.0,1.1706250566298675,71,58,0.8169014084507042,392,6,0.175,0.075,0.025,0.1,0.025,0.15,0.0,0.175,0.0,0.0,0.0375,0.05,0.1125,0.0125,0.0,0.0625,0.0,true,35.0,0.8875,4.9,80.0,0.0,0.0,0.0,0.0,0.0,0.0,0.0,0.0,0.0,0.0,0.0,0.0,0.0,0.0,0.0,0.0125
user,"Genial, gracias por las recomendaciones. Me encantaría probar El Pimpi y El Mesón de Cervantes. La comida andaluza es famosa por sus sabores intensos y frescos, y estoy seguro de que voy a disfrutar de mis comidas en Málaga. Me alegra pensar que podamos seguir charlando sobre comida y flamenco cuando vuelva a visitar Madrid. Ha sido un placer hablar contigo, Ana. Hasta luego.",meta-llama--Llama-3.1-8B-Instruct,A1,20250322-224453.json,0.30138357579708097,0.38140011951327324,2.3297149473620062,0.696558154383736,0.3532121473297944,0.10806734851285102,4.78125,5.0,2.7412859094775213,10.666666666666666,8.5,7.386173268720112,1.9375,2.0,1.0135796712641785,64,53,0.828125,315,6,0.0684931506849315,0.136986301369863,0.0136986301369863,0.0821917808219178,0.0547945205479452,0.0958904109589041,0.0,0.1232876712328767,0.0,0.0,0.0410958904109589,0.0821917808219178,0.1232876712328767,0.0410958904109589,0.0,0.136986301369863,0.0,true,33.0,0.8767123287671232,4.315068493150685,73.0,0.0,0.0,0.0,0.0,0.0,0.0,0.0,0.0,0.0,0.0,0.0,0.0,0.0,0.0,0.0,0.0
assistant,"Fue un placer charlar contigo también. Espero verte pronto en Madrid, o mejor aún, en Málaga. Que disfrutes de tus próximos viajes y de la buena comida y música que encuentres. Hasta luego, ¡adiós por ahora!",meta-llama--Llama-3.1-8B-Instruct,A1,20250322-224453.json,0.42066405216852826,0.27452073991298676,2.2534340659340657,0.6059183334230505,0.3944024725274725,0.05647837976586739,4.555555555555555,5.0,2.290614236454256,9.0,8.0,3.9370039370059056,1.7777777777777777,2.0,0.7856742013183861,36,32,0.8888888888888888,172,4,0.06818181818181818,0.13636363636363635,0.11363636363636363,0.022727272727272728,0.06818181818181818,0.06818181818181818,0.0,0.11363636363636363,0.0,0.0,0.022727272727272728,0.06818181818181818,0.18181818181818182,0.022727272727272728,0.0,0.11363636363636363,0.0,true,24.0,0.8181818181818182,3.909090909090909,44.0,0.0,0.0,0.0,0.0,0.0,0.0,0.0,0.0,0.0,0.0,0.0,0.0,0.0,0.0,0.0,0.0
user,"Hasta luego, Ana. Que tengas un buen día y que te sigan sonando las melodías de flamenco mientras esperas mi regreso. Adiós.",meta-llama--Llama-3.1-8B-Instruct,A1,20250322-224453.json,0.2238505706191063,0.4989917576313019,1.5982456140350878,0.9876460662765056,0.44035087719298244,0.04304506718029929,4.5,4.5,2.210512075597787,7.333333333333333,3.0,7.586537784494029,1.6818181818181819,1.0,0.8194434716963611,22,21,0.9545454545454546,103,3,0.038461538461538464,0.038461538461538464,0.038461538461538464,0.0,0.038461538461538464,0.11538461538461539,0.038461538461538464,0.19230769230769232,0.0,0.0,0.038461538461538464,0.038461538461538464,0.15384615384615385,0.11538461538461539,0.0,0.15384615384615385,0.0,true,13.0,0.8461538461538461,3.9615384615384617,26.0,0.0,0.0,0.0,0.0,0.0,0.0,0.0,0.0,0.0,0.0,0.0,0.0,0.0,0.0,0.0,0.0
system,"You are an AI language tutor assisting a student in learning Spanish by acting as their dialogue partner.
The student is learning Spanish at A1 level in the Common European Framework of Reference (CEFR) which means that the user is at a beginner level of Spanish.

As an AI tutor, your instructions are:
1. Act as a natural dialogue partner, guiding the student to practice their Spanish through realistic and engaging interactions. This means asking the student questions in a natural manner.
2. Limit your grammar and vocabulary to A1-level Spanish (beginner level).
3. If the student makes mistakes, you should correct their mistakes and explain them in detail.
4. Keep everything in Spanish.

Remember to keep the conversation at a language level appropriate for a beginner learner of Spanish. Specifically, the aim for the student is to master the following language skills after A1: 
- The student understand and use familiar everyday expressions and very basic phrases aimed at the satisfaction of needs of a concrete type.
- The student can introduce him/herself and others and can ask and answer questions about personal details such as where he/she lives, people he/she knows and things he/she has.
- The student can interact in a simple way provided the other person talks slowly and clearly and is prepared to help.
",meta-llama--Llama-3.1-8B-Instruct,A1,20250322-224624.json,0.7075007617473602,0.6994680629836189,4.351010554824339,1.289030883923605,0.34173989694453905,0.08269101007888388,4.701298701298701,4.0,2.751142706615347,21.0,17.0,17.273205734999983,1.6753246753246753,1.0,0.8940625472017476,231,124,0.5367965367965368,1119,11,0.026515151515151516,0.06439393939393939,0.0,0.003787878787878788,0.0,0.0,0.0,0.06060606060606061,0.015151515151515152,0.0,0.003787878787878788,0.625,0.125,0.0,0.0,0.03409090909090909,0.0,true,11.0,0.8181818181818182,4.238636363636363,264.0,0.0,0.0,0.21428571428571427,0.0,0.0,0.0,0.0286144578313253,0.0286144578313253,0.0,0.0,0.0,0.0,0.010542168674698794,0.01355421686746988,0.03162650602409638,0.06060606060606061
user,Hola,meta-llama--Llama-3.1-8B-Instruct,A1,20250322-224624.json,,,0.0,0.0,0.0,0.0,4.0,4.0,0.0,1.0,1.0,0.0,2.0,2.0,0.0,1,1,1.0,4,1,0.0,0.0,0.0,0.0,0.0,0.0,0.0,0.0,0.0,0.0,0.0,1.0,0.0,0.0,0.0,0.0,0.0,false,0.0,1.0,4.0,1.0,0.0,0.0,0.0,0.0,0.0,0.0,0.0,0.0,0.0,0.0,0.0,0.0,0.0,0.0,0.0,0.0
assistant,¡hola! ¿Cómo estás? ¿De dónde eres?,meta-llama--Llama-3.1-8B-Instruct,A1,20250322-224624.json,0.7797046303749084,,1.3142857142857143,0.11428571428571432,0.5857142857142856,0.01428571428571429,4.0,4.0,1.0,3.0,3.0,0.0,1.6666666666666667,2.0,0.4714045207910317,6,6,1.0,30,2,0.0,0.08333333333333333,0.0,0.08333333333333333,0.0,0.0,0.0,0.0,0.0,0.0,0.16666666666666666,0.08333333333333333,0.5,0.0,0.0,0.08333333333333333,0.0,false,4.0,0.5,2.5,12.0,0.0,0.0,0.0,0.0,0.0,0.0,0.0,0.0,0.0,0.0,0.0,0.0,0.0,0.0,0.0,0.0
user,"¡Hola! Estoy bien, gracias. Soy de Estados Unidos, pero actualmente estoy estudiando en Madrid para mejorar mi español. ¿Y tú?",meta-llama--Llama-3.1-8B-Instruct,A1,20250322-224624.json,0.15093538630753756,0.4783005118370056,1.75,0.7359800721939872,0.4583333333333333,0.05892556509887896,4.95,4.5,2.6358110706194404,6.666666666666667,4.0,5.2493385826745405,2.0,2.0,0.9486832980505138,20,19,0.95,107,3,0.0,0.10714285714285714,0.07142857142857142,0.10714285714285714,0.07142857142857142,0.03571428571428571,0.0,0.07142857142857142,0.0,0.0,0.03571428571428571,0.14285714285714285,0.2857142857142857,0.0,0.0,0.07142857142857142,0.0,true,12.0,0.7142857142857143,3.8214285714285716,28.0,0.0,0.0,0.0,0.0,0.0,0.0,0.0,0.0,0.0,0.0,0.0,0.0,0.0,0.0,0.0,0.0
assistant,"¡Excelente elección, Madrid es una ciudad hermosa! Yo soy española y vivo aquí desde que nací. Me encanta esta ciudad. ¿Por qué decidiste estudiar español en Madrid? ¿Estás disfrutando mucho de la vida aquí?",meta-llama--Llama-3.1-8B-Instruct,A1,20250322-224624.json,0.4491158177455266,0.3444921672344208,2.0180555555555557,0.44947457322445816,0.4222222222222222,0.08164965809277261,4.852941176470588,4.0,2.4630487198875692,8.5,7.0,4.5,1.9411764705882353,2.0,0.9982683969692436,34,31,0.9117647058823529,174,4,0.09302325581395349,0.09302325581395349,0.06976744186046512,0.06976744186046512,0.023255813953488372,0.06976744186046512,0.0,0.09302325581395349,0.0,0.0,0.06976744186046512,0.046511627906976744,0.20930232558139536,0.023255813953488372,0.0,0.13953488372093023,0.0,true,17.0,0.7906976744186046,4.046511627906977,43.0,0.0,0.0,0.0,0.0,0.0,0.0,0.0,0.0,0.0,0.0,0.0,0.0,0.0,0.0,0.0,0.0
user,"Sí, ¡Madrid es increíble! Me gusta mucho la cultura y la historia aquí. Decidí estudiar español en Madrid porque quería inmersarme completamente en el idioma y aprender sobre la cultura española de forma auténtica. Me parece que vivir aquí me ayudará a mejorar mi comprensión del lenguaje y a desarrollar mis habilidades comunicativas. Y sí, estoy disfrutando mucho de la vida en Madrid. La comida es deliciosa, los museos son increíbles y hay muchísima energía y diversidad en la ciudad. ¿Te gustan algunos lugares en particular de Madrid o actividades que te recomiendas?",meta-llama--Llama-3.1-8B-Instruct,A1,20250322-224624.json,0.46540974974632265,0.4866444393992424,2.614724645839197,0.20052401337175096,0.43995449854582985,0.06672472946634614,5.043010752688172,5.0,3.275566038237074,15.5,15.0,3.8188130791298667,2.064516129032258,2.0,1.2339851658447116,93,64,0.6881720430107527,481,6,0.06666666666666667,0.11428571428571428,0.05714285714285714,0.047619047619047616,0.06666666666666667,0.11428571428571428,0.009523809523809525,0.1619047619047619,0.0,0.0,0.05714285714285714,0.0380952380952381,0.11428571428571428,0.01904761904761905,0.0,0.13333333333333333,0.0,true,50.0,0.8857142857142857,4.580952380952381,105.0,0.0,0.0,0.0,0.0,0.0,0.0,0.0,0.0,0.0,0.0,0.0,0.0,0.0,0.0,0.0,0.009523809523809525
assistant,"Eres muy entusiasta, ¡me alegra verte así! Sí, Madrid tiene mucho que ofrecer. Un lugar que te recomiendo es el Museo del Prado, es uno de los mejores del mundo. La pintura española es famosa por artistas como Goya, Velázquez y El Greco. ¿Has visitado el museo ya?

Y otra cosa, ¿qué piensas de la comida madrileña? ¿La vas a probar la gazpacho o la tortilla de patatas mientras estés aquí?",meta-llama--Llama-3.1-8B-Instruct,A1,20250322-224624.json,0.48707473029692966,0.27107835114002227,2.141854636591479,0.41356641475668954,0.41691729323308274,0.06451218615053356,4.236111111111111,3.5,2.4065481016244195,10.285714285714286,9.0,4.060762972443398,1.75,1.0,0.982485510212633,72,58,0.8055555555555556,321,7,0.056818181818181816,0.07954545454545454,0.056818181818181816,0.07954545454545454,0.03409090909090909,0.11363636363636363,0.011363636363636364,0.11363636363636363,0.0,0.0,0.07954545454545454,0.06818181818181818,0.18181818181818182,0.022727272727272728,0.0,0.09090909090909091,0.0,true,40.0,0.8068181818181818,3.647727272727273,88.0,0.0,0.0,0.0,0.0,0.0,0.0,0.0,0.0,0.0,0.0,0.0,0.0,0.0,0.0,0.0,0.011363636363636364
user,"Me encantaría visitar el Museo del Prado, es uno de los sitios más importantes que quiero ver en Madrid. He oído que cuenta con una gran colección de obras maestras, incluyendo las de los artistas que mencionaste. Espero poder ir pronto y admirarlas en persona.

En cuanto a la comida, estoy emocionado de experimentar la gastronomía madrileña. La gazpacho y la tortilla de patatas suenan deliciosas. De hecho, anoche probé un plato típico llamado tapas y fue genial. Me encantó el ambiente relajado y la variedad de opciones para elegir. ¿Cuál crees que es el mejor tipo de tapas que hay en Madrid?

(Por cierto, ¿podrías repetir ""tapas"" para que yo lo pueda escribir correctamente?)",meta-llama--Llama-3.1-8B-Instruct,A1,20250322-224624.json,0.5024444077696119,0.47925785680611926,2.448191391941392,0.6015920061978033,0.45114468864468865,0.053323740199858805,4.717948717948718,4.0,2.8188806466280645,14.625,12.0,5.521265706339444,1.8888888888888888,2.0,1.0763802729183702,117,85,0.7264957264957265,572,8,0.08759124087591241,0.13138686131386862,0.029197080291970802,0.06569343065693431,0.029197080291970802,0.0948905109489051,0.0,0.145985401459854,0.0,0.0,0.06569343065693431,0.029197080291970802,0.145985401459854,0.021897810218978103,0.0,0.1386861313868613,0.0,true,65.0,0.8394160583941606,4.175182481751825,137.0,0.0,0.0,0.0,0.0,0.0,0.0,0.0,0.0,0.0,0.0,0.0,0.0,0.0,0.0,0.0,0.014598540145985401
